{
    "$schema": "./schemas/commands.schema.json",
    "version": "1.0.0",
    "globalAliases": {
        "l": "look",
        "x": "examine",
        "n": "north",
        "s": "south",
        "e": "east",
        "w": "west",
        "u": "up",
        "d": "down",
        "i": "inventory",
        "a": "attack",
        "h": "help",
        "q": "quit"
    },
    "ignoredWords": [
        "the",
        "a",
        "an",
        "to",
        "at",
        "with",
        "on",
        "in",
        "from",
        "and",
        "my",
        "using"
    ],
    "categories": [
        {
            "id": "Movement",
            "name": "Movement",
            "description": "Commands for navigating the world",
            "sortOrder": 1,
            "icon": "icon-movement"
        },
        {
            "id": "Combat",
            "name": "Combat",
            "description": "Commands for battle and conflict",
            "sortOrder": 2,
            "icon": "icon-combat"
        },
        {
            "id": "Interaction",
            "name": "Interaction",
            "description": "Commands for examining and interacting with the world",
            "sortOrder": 3,
            "icon": "icon-interaction"
        },
        {
            "id": "Inventory",
            "name": "Inventory",
            "description": "Commands for managing items and equipment",
            "sortOrder": 4,
            "icon": "icon-inventory"
        },
        {
            "id": "Information",
            "name": "Information",
            "description": "Commands for viewing status and information",
            "sortOrder": 5,
            "icon": "icon-info"
        },
        {
            "id": "Social",
            "name": "Social",
            "description": "Commands for communication",
            "sortOrder": 6,
            "icon": "icon-social"
        },
        {
            "id": "System",
            "name": "System",
            "description": "Meta commands and settings",
            "sortOrder": 7,
            "icon": "icon-system"
        },
        {
            "id": "Debug",
            "name": "Debug",
            "description": "Developer and testing commands",
            "sortOrder": 99,
            "icon": "icon-debug"
        }
    ],
    "commands": [
        {
            "id": "look",
            "name": "look",
            "aliases": [
                "examine",
                "inspect",
                "view"
            ],
            "category": "Interaction",
            "description": "Examine your surroundings or a specific target",
            "arguments": [
                {
                    "name": "target",
                    "type": "Target",
                    "description": "What to look at",
                    "isRequired": false,
                    "displayHint": "[target]"
                }
            ],
            "contexts": [
                "Exploration",
                "Combat",
                "Inventory"
            ],
            "help": {
                "usage": "look [target]",
                "examples": [
                    {
                        "input": "look",
                        "description": "Describe your current location"
                    },
                    {
                        "input": "look door",
                        "description": "Examine the door in detail"
                    },
                    {
                        "input": "look goblin",
                        "description": "Study the goblin before you"
                    },
                    {
                        "input": "l north",
                        "description": "Look to the north"
                    }
                ],
                "notes": "Without a target, describes your current location. Use 'examine' for more detailed inspection.",
                "seeAlso": [
                    "search",
                    "go"
                ]
            },
            "tags": [
                "observation",
                "exploration",
                "basic"
            ]
        },
        {
            "id": "go",
            "name": "go",
            "aliases": [
                "move",
                "walk",
                "travel"
            ],
            "category": "Movement",
            "description": "Move in a direction or to a location",
            "arguments": [
                {
                    "name": "direction",
                    "type": "Direction",
                    "description": "Direction to move",
                    "isRequired": true,
                    "displayHint": "<direction>"
                }
            ],
            "contexts": [
                "Exploration"
            ],
            "help": {
                "usage": "go <direction>",
                "examples": [
                    {
                        "input": "go north",
                        "description": "Move north"
                    },
                    {
                        "input": "go up",
                        "description": "Climb upward"
                    },
                    {
                        "input": "n",
                        "description": "Shorthand for 'go north'"
                    }
                ],
                "notes": "Cardinal directions (n/s/e/w) can be typed directly without 'go'.",
                "seeAlso": [
                    "north",
                    "south",
                    "east",
                    "west",
                    "enter",
                    "exit"
                ]
            },
            "tags": [
                "movement",
                "navigation",
                "basic"
            ]
        },
        {
            "id": "north",
            "name": "north",
            "aliases": [],
            "category": "Movement",
            "description": "Move north",
            "contexts": [
                "Exploration"
            ],
            "help": {
                "usage": "north",
                "examples": [
                    {
                        "input": "north",
                        "description": "Move north"
                    },
                    {
                        "input": "n",
                        "description": "Shorthand"
                    }
                ]
            },
            "tags": [
                "movement",
                "direction"
            ]
        },
        {
            "id": "south",
            "name": "south",
            "aliases": [],
            "category": "Movement",
            "description": "Move south",
            "contexts": [
                "Exploration"
            ],
            "help": {
                "usage": "south",
                "examples": [
                    {
                        "input": "south",
                        "description": "Move south"
                    },
                    {
                        "input": "s",
                        "description": "Shorthand"
                    }
                ]
            },
            "tags": [
                "movement",
                "direction"
            ]
        },
        {
            "id": "east",
            "name": "east",
            "aliases": [],
            "category": "Movement",
            "description": "Move east",
            "contexts": [
                "Exploration"
            ],
            "help": {
                "usage": "east"
            },
            "tags": [
                "movement",
                "direction"
            ]
        },
        {
            "id": "west",
            "name": "west",
            "aliases": [],
            "category": "Movement",
            "description": "Move west",
            "contexts": [
                "Exploration"
            ],
            "help": {
                "usage": "west"
            },
            "tags": [
                "movement",
                "direction"
            ]
        },
        {
            "id": "attack",
            "name": "attack",
            "aliases": [
                "hit",
                "strike",
                "fight"
            ],
            "category": "Combat",
            "description": "Attack a target with your equipped weapon",
            "arguments": [
                {
                    "name": "target",
                    "type": "Target",
                    "description": "Enemy to attack",
                    "isRequired": true,
                    "displayHint": "<target>"
                },
                {
                    "name": "weapon",
                    "type": "Item",
                    "description": "Weapon to use (default: equipped)",
                    "isRequired": false,
                    "displayHint": "[with <weapon>]"
                }
            ],
            "contexts": [
                "Combat"
            ],
            "requiresTarget": true,
            "help": {
                "usage": "attack <target> [with <weapon>]",
                "examples": [
                    {
                        "input": "attack goblin",
                        "description": "Attack the goblin with equipped weapon"
                    },
                    {
                        "input": "attack goblin with dagger",
                        "description": "Attack using your dagger"
                    },
                    {
                        "input": "a goblin",
                        "description": "Shorthand attack"
                    }
                ],
                "notes": "If only one enemy is present, the target can be omitted.",
                "seeAlso": [
                    "defend",
                    "cast",
                    "use",
                    "flee"
                ]
            },
            "tags": [
                "combat",